{
  "$schema": "http://json-schema.org/draft-07/schema#",
  "title": "PlayerCard",
  "type": "object",
  "required": [
    "id",
    "name",
    "position",
    "teamId",
    "year",
    "tables"
  ],
  "properties": {
    "id": {
      "type": "string"
    },
    "name": {
      "type": "string"
    },
    "position": {
      "type": "string"
    },
    "teamId": {
      "type": "string"
    },
    "year": {
      "type": "number"
    },
    "tables": {
      "type": "object",
      "properties": {
        "insideRun": {
          "type": "array",
          "items": {
            "type": "object",
            "required": [
              "min",
              "max",
              "result"
            ],
            "properties": {
              "min": {
                "type": "number"
              },
              "max": {
                "type": "number"
              },
              "result": {
                "type": "string"
              }
            }
          }
        },
        "outsideRun": {
          "type": "array",
          "items": {
            "type": "object",
            "required": [
              "min",
              "max",
              "result"
            ],
            "properties": {
              "min": {
                "type": "number"
              },
              "max": {
                "type": "number"
              },
              "result": {
                "type": "string"
              }
            }
          }
        },
        "shortPass": {
          "type": "array",
          "items": {
            "type": "object",
            "required": [
              "min",
              "max",
              "result"
            ],
            "properties": {
              "min": {
                "type": "number"
              },
              "max": {
                "type": "number"
              },
              "result": {
                "type": "string"
              }
            }
          }
        },
        "longPass": {
          "type": "array",
          "items": {
            "type": "object",
            "required": [
              "min",
              "max",
              "result"
            ],
            "properties": {
              "min": {
                "type": "number"
              },
              "max": {
                "type": "number"
              },
              "result": {
                "type": "string"
              }
            }
          }
        },
        "qbScramble": {
          "type": "array",
          "items": {
            "type": "object",
            "required": [
              "min",
              "max",
              "result"
            ],
            "properties": {
              "min": {
                "type": "number"
              },
              "max": {
                "type": "number"
              },
              "result": {
                "type": "string"
              }
            }
          }
        },
        "fieldGoal": {
          "type": "array",
          "items": {
            "type": "object",
            "required": [
              "min",
              "max",
              "result"
            ],
            "properties": {
              "min": {
                "type": "number"
              },
              "max": {
                "type": "number"
              },
              "result": {
                "type": "string"
              }
            }
          }
        },
        "punt": {
          "type": "array",
          "items": {
            "type": "object",
            "required": [
              "min",
              "max",
              "result"
            ],
            "properties": {
              "min": {
                "type": "number"
              },
              "max": {
                "type": "number"
              },
              "result": {
                "type": "string"
              }
            }
          }
        }
      },
      "additionalProperties": false
    }
  }
}